,question,0,1,2,3,4,5,6,7,8,9,10,11,12,13,14,15,16,17,18,19,20,21,22,23,24,25,26,27,28,29,30,31,32,33,34,35,36,37,38,39,40,41,42,43,44,45,46,47,48,49,50,51,52,53,54,55,56,57
0,find build room capac 50,1,0,0,0,0,0,0,0,0,0,0,0,1,0,1,0,1,0,0,0,0,0,0,0,0,0,0,0,0,0,1,0,0,0,0,0,0,0,0,0,0,0,0,0,0,0,0,0,0,0,0,0,0,0,0,0,0,0
1,distinct build capac greater 50,1,0,0,0,0,0,0,0,0,0,0,0,1,0,1,0,1,0,0,0,0,0,0,0,0,0,0,0,0,0,1,0,0,0,0,0,0,0,0,0,0,0,0,0,0,0,0,0,0,0,0,0,0,0,0,0,0,0
2,count number room lamberton build,1,0,0,0,0,0,0,0,0,0,0,1,1,0,0,0,1,0,0,0,0,0,0,0,0,0,0,0,0,0,1,0,0,0,0,0,0,0,0,0,0,0,0,0,0,0,0,0,0,0,0,0,0,0,0,0,0,0
3,mani classroom lamberton,1,0,0,0,0,0,0,0,0,0,0,1,1,0,0,0,1,0,0,0,0,0,0,0,0,0,0,0,0,0,1,0,0,0,0,0,0,0,0,0,0,0,0,0,0,0,0,0,0,0,0,0,0,0,0,0,0,0
4,name build depart whose budget averag budget,0,1,0,0,0,0,0,0,0,0,0,0,1,0,0,1,1,1,0,0,1,0,0,0,1,0,0,0,0,0,1,0,0,0,0,0,0,0,0,0,1,0,0,0,0,0,0,0,0,0,0,0,0,0,0,0,0,0
5,give name build depart greater averag budget,0,1,0,0,0,0,0,0,0,0,0,0,1,0,0,1,1,1,0,0,1,0,0,0,1,0,0,0,0,0,1,0,0,0,0,0,0,0,0,0,1,0,0,0,0,0,0,0,0,0,0,0,0,0,0,0,0,0
6,find room number room sit 50 100 student build,1,0,0,0,0,0,0,0,0,0,0,0,1,1,1,0,1,0,0,0,0,0,0,0,0,0,0,0,0,0,1,1,0,0,0,0,0,0,0,0,0,0,0,0,0,0,0,0,0,0,0,0,0,0,0,0,0,0
7,room number correspond build classroom seat 50 100 student,1,0,0,0,0,0,0,0,0,0,0,0,1,1,1,0,1,0,0,0,0,0,0,0,0,0,0,0,0,0,1,1,0,0,0,0,0,0,0,0,0,0,0,0,0,0,0,0,0,0,0,0,0,0,0,0,0,0
8,find name build depart highest budget,0,1,0,0,0,0,0,0,0,0,0,0,1,0,0,1,1,1,0,0,1,0,0,0,1,0,0,0,0,0,1,0,0,0,0,0,0,0,0,0,1,0,0,0,0,0,0,0,0,0,0,0,0,0,0,0,0,0
9,depart name correspond build depart greatest budget,0,1,0,0,0,0,0,0,0,0,0,0,1,0,0,1,1,1,0,0,1,0,0,0,1,0,0,0,0,0,1,0,0,0,0,0,0,0,0,0,1,0,0,0,0,0,0,0,0,0,0,0,0,0,0,0,0,0
10,name student highest total credit histori depart,0,0,0,0,0,0,1,0,0,0,0,0,0,0,0,1,0,0,0,0,1,0,0,1,1,0,0,0,0,0,0,0,0,0,0,0,0,0,0,1,1,1,0,0,0,0,0,0,0,0,0,0,0,0,0,0,0,0
11,give name student histori depart credit,0,0,0,0,0,0,1,0,0,0,0,0,0,0,0,1,0,0,0,0,1,0,0,1,1,0,0,0,0,0,0,0,0,0,0,0,0,0,0,1,1,1,0,0,0,0,0,0,0,0,0,0,0,0,0,0,0,0
12,mani room lamberton build,1,0,0,0,0,0,0,0,0,0,0,1,1,0,0,0,1,0,0,0,0,0,0,0,0,0,0,0,0,0,1,0,0,0,0,0,0,0,0,0,0,0,0,0,0,0,0,0,0,0,0,0,0,0,0,0,0,0
13,count number classroom lamberton,1,0,0,0,0,0,0,0,0,0,0,1,1,0,0,0,1,0,0,0,0,0,0,0,0,0,0,0,0,0,1,0,0,0,0,0,0,0,0,0,0,0,0,0,0,0,0,0,0,0,0,0,0,0,0,0,0,0
14,mani student advisor,0,0,0,0,0,0,0,0,1,0,0,0,0,0,0,0,0,0,0,0,0,0,0,0,0,0,0,0,0,0,0,0,0,0,0,0,0,0,0,0,0,0,0,0,0,0,0,0,1,0,0,0,0,0,0,0,0,0
15,count number student advisor,0,0,0,0,0,0,0,0,1,0,0,0,0,0,0,0,0,0,0,0,0,0,0,0,0,0,0,0,0,0,0,0,0,0,0,0,0,0,0,0,0,0,0,0,0,0,0,0,1,0,0,0,0,0,0,0,0,0
16,mani depart offer cours,0,0,1,0,0,0,0,0,0,0,0,0,0,0,0,1,0,0,0,0,1,0,0,0,1,0,0,0,0,0,0,0,0,0,0,0,0,0,0,0,1,0,0,0,0,0,0,0,0,0,0,0,0,0,0,0,0,0
17,count number depart offer cours,0,0,1,0,0,0,0,0,0,0,0,0,0,0,0,1,0,0,0,0,1,0,0,0,1,0,0,0,0,0,0,0,0,0,0,0,0,0,0,0,1,0,0,0,0,0,0,0,0,0,0,0,0,0,0,0,0,0
18,mani differ cours offer physic depart,0,0,1,0,0,0,0,0,0,0,0,0,0,0,0,1,0,0,1,0,1,0,0,0,1,0,1,0,0,0,0,0,0,0,1,0,0,0,0,0,1,0,0,1,0,0,0,0,0,0,0,0,0,0,0,0,1,0
19,count number cours physic depart,0,0,1,0,0,0,0,0,0,0,0,0,0,0,0,1,0,0,1,0,1,0,0,0,1,0,1,0,0,0,0,0,0,0,1,0,0,0,0,0,1,0,0,1,0,0,0,0,0,0,0,0,0,0,0,0,1,0
20,find titl cours two prerequisit,0,0,1,0,0,0,0,0,0,0,1,1,0,0,0,0,0,0,1,1,0,0,0,0,0,0,1,0,0,0,0,0,0,0,1,0,0,0,0,0,0,0,0,1,0,0,0,0,0,0,0,0,0,0,0,0,1,0
21,titl cours two prerequisit,0,0,1,0,0,0,0,0,0,0,1,1,0,0,0,0,0,0,1,1,0,0,0,0,0,0,1,0,0,0,0,0,0,0,1,0,0,0,0,0,0,0,0,1,0,0,0,0,0,0,0,0,0,0,0,0,1,0
22,find titl credit depart name cours one prerequisit,0,0,1,0,0,0,0,0,0,0,1,1,0,0,0,1,0,0,1,1,1,1,0,0,1,0,1,0,0,0,0,0,0,0,1,0,0,0,0,0,1,0,0,1,0,0,0,0,0,0,0,0,0,0,0,0,1,0
23,titl credit valu depart name cours one prerequisit,0,0,1,0,0,0,0,0,0,0,1,1,0,0,0,1,0,0,1,1,1,1,0,0,1,0,1,0,0,0,0,0,0,0,1,0,0,0,0,0,1,0,0,1,0,0,0,0,0,0,0,0,0,0,0,0,1,0
24,mani cours prerequisit,0,0,1,0,0,0,0,0,0,0,1,1,0,0,0,0,0,0,1,0,0,0,0,0,0,0,1,0,0,0,0,0,0,0,1,0,0,0,0,0,0,0,0,1,0,0,0,0,0,0,0,0,0,0,0,0,1,0
25,count number cours without prerequisit,0,0,1,0,0,0,0,0,0,0,1,1,0,0,0,0,0,0,1,0,0,0,0,0,0,0,1,0,0,0,0,0,0,0,1,0,0,0,0,0,0,0,0,1,0,0,0,0,0,0,0,0,0,0,0,0,1,0
26,find name cours prerequisit,0,0,1,0,0,0,0,0,0,0,1,0,0,0,0,0,0,0,1,1,0,0,0,0,0,0,1,0,0,0,0,0,0,0,1,0,0,0,0,0,0,0,0,1,0,0,0,0,0,0,0,0,0,0,0,0,1,0
27,titl cours without prerequisit,0,0,1,0,0,0,0,0,0,0,1,0,0,0,0,0,0,0,1,1,0,0,0,0,0,0,1,0,0,0,0,0,0,0,1,0,0,0,0,0,0,0,0,1,0,0,0,0,0,0,0,0,0,0,0,0,1,0
28,mani differ instructor taught cours,0,0,0,0,0,1,0,0,0,0,0,0,0,0,0,0,0,0,0,0,0,0,1,0,0,0,0,0,0,0,0,0,0,1,0,0,0,0,1,0,0,0,1,0,0,0,0,0,0,0,0,0,0,0,0,0,0,0
29,count number distinct instructor taught cours,0,0,0,0,0,1,0,0,0,0,0,0,0,0,0,0,0,0,0,0,0,0,1,0,0,0,0,0,0,0,0,0,0,1,0,0,0,0,1,0,0,0,1,0,0,0,0,0,0,0,0,0,0,0,0,0,0,0
30,find total budget market financ depart,0,1,0,0,0,0,0,0,0,0,0,0,0,0,0,1,0,1,0,0,1,0,0,0,1,0,0,0,0,0,0,0,0,0,0,0,0,0,0,0,1,0,0,0,0,0,0,0,0,0,0,0,0,0,0,0,0,0
31,sum budget market financ depart,0,1,0,0,0,0,0,0,0,0,0,0,0,0,0,1,0,1,0,0,1,0,0,0,1,0,0,0,0,0,0,0,0,0,0,0,0,0,0,0,1,0,0,0,0,0,0,0,0,0,0,0,0,0,0,0,0,0
32,find depart name instructor whose name contain soisalon,0,0,0,1,0,0,0,0,0,0,0,0,0,0,0,1,0,0,0,0,1,0,0,1,1,0,0,0,0,0,0,0,0,0,0,0,0,0,0,1,1,0,0,0,0,0,0,0,0,0,0,0,0,0,0,0,0,0
33,name depart instructur name like soisalon,0,0,0,1,0,0,0,0,0,0,0,0,0,0,0,1,0,0,0,0,1,0,0,1,1,0,0,0,0,0,0,0,0,0,0,0,0,0,0,1,1,0,0,0,0,0,0,0,0,0,0,0,0,0,0,0,0,0
34,mani room whose capac less 50 lamberton build,1,0,0,0,0,0,0,0,0,0,0,1,1,0,1,0,1,0,0,0,0,0,0,0,0,0,0,0,0,0,1,0,0,0,0,0,0,0,0,0,0,0,0,0,0,0,0,0,0,0,0,0,0,0,0,0,0,0
35,count number room lamberton capac lower 50,1,0,0,0,0,0,0,0,0,0,0,1,1,0,1,0,1,0,0,0,0,0,0,0,0,0,0,0,0,0,1,0,0,0,0,0,0,0,0,0,0,0,0,0,0,0,0,0,0,0,0,0,0,0,0,0,0,0
36,find name budget depart whose budget averag budget,0,1,0,0,0,0,0,0,0,0,0,0,0,0,0,1,0,1,0,0,1,0,0,0,1,0,0,0,0,0,0,0,0,0,0,0,0,0,0,0,1,0,0,0,0,0,0,0,0,0,0,0,0,0,0,0,0,0
37,name budget depart budget greater averag,0,1,0,0,0,0,0,0,0,0,0,0,0,0,0,1,0,1,0,0,1,0,0,0,1,0,0,0,0,0,0,0,0,0,0,0,0,0,0,0,1,0,0,0,0,0,0,0,0,0,0,0,0,0,0,0,0,0
38,name instructor statist depart earn lowest salari,0,0,0,1,0,0,0,0,0,0,0,0,0,0,0,1,0,0,0,0,1,0,0,1,1,1,0,0,0,0,0,0,0,0,0,0,0,0,0,1,1,0,0,0,0,0,0,0,0,0,0,0,0,0,0,0,0,0
39,give name lowest earn instructor statist depart,0,0,0,1,0,0,0,0,0,0,0,0,0,0,0,1,0,0,0,0,1,0,0,1,1,1,0,0,0,0,0,0,0,0,0,0,0,0,0,1,1,0,0,0,0,0,0,0,0,0,0,0,0,0,0,0,0,0
40,find titl cours provid statist psycholog depart,0,0,1,0,0,0,0,0,0,0,0,0,0,0,0,1,0,0,0,1,1,0,0,0,1,0,0,0,0,0,0,0,0,0,0,0,0,0,0,0,1,0,0,0,0,0,0,0,0,0,0,0,0,0,0,0,0,0
41,titl cours list statist psycholog depart,0,0,1,0,0,0,0,0,0,0,0,0,0,0,0,1,0,0,0,1,1,0,0,0,1,0,0,0,0,0,0,0,0,0,0,0,0,0,0,0,1,0,0,0,0,0,0,0,0,0,0,0,0,0,0,0,0,0
42,find titl cours provid statist psycholog depart,0,0,1,0,0,0,0,0,0,0,0,0,0,0,0,1,0,0,0,1,1,0,0,0,1,0,0,0,0,0,0,0,0,0,0,0,0,0,0,0,1,0,0,0,0,0,0,0,0,0,0,0,0,0,0,0,0,0
43,titl cours statist depart psycholog depart,0,0,1,0,0,0,0,0,0,0,0,0,0,0,0,1,0,0,0,1,1,0,0,0,1,0,0,0,0,0,0,0,0,0,0,0,0,0,0,0,1,0,0,0,0,0,0,0,0,0,0,0,0,0,0,0,0,0
44,find id instructor taught class fall 2009 spring 2010,0,0,0,0,0,1,0,0,0,0,0,0,0,0,0,0,0,0,0,0,0,0,1,0,0,0,0,0,1,1,0,0,0,1,0,0,1,1,1,0,0,0,1,0,0,1,1,0,0,0,0,0,0,0,0,0,0,0
45,id instructor taught fall 2009 spring 2010,0,0,0,0,0,1,0,0,0,0,0,0,0,0,0,0,0,0,0,0,0,0,1,0,0,0,0,0,1,1,0,0,0,1,0,0,1,1,1,0,0,0,1,0,0,1,1,0,0,0,0,0,0,0,0,0,0,0
46,find name student took class year 2009 2010,0,0,0,0,0,0,1,1,0,0,0,0,0,0,0,0,0,0,0,0,0,0,1,1,0,0,0,0,0,1,0,0,0,1,0,0,0,1,1,1,0,0,1,0,0,0,1,0,0,0,0,0,0,0,0,0,0,0
47,name student took class 2009 2010,0,0,0,0,0,0,1,1,0,0,0,0,0,0,0,0,0,0,0,0,0,0,1,1,0,0,0,0,0,1,0,0,0,1,0,0,0,1,1,1,0,0,1,0,0,0,1,0,0,0,0,0,0,0,0,0,0,0
48,find name top 3 depart provid largest amount cours,0,0,1,0,0,0,0,0,0,0,0,1,0,0,0,1,0,0,0,0,1,0,0,0,1,0,0,0,0,0,0,0,0,0,0,0,0,0,0,0,1,0,0,0,0,0,0,0,0,0,0,0,0,0,0,0,0,0
49,name 3 depart cours,0,0,1,0,0,0,0,0,0,0,0,1,0,0,0,1,0,0,0,0,1,0,0,0,1,0,0,0,0,0,0,0,0,0,0,0,0,0,0,0,1,0,0,0,0,0,0,0,0,0,0,0,0,0,0,0,0,0
50,find name depart offer highest total credit,0,0,1,0,0,0,0,0,0,0,0,0,0,0,0,1,0,0,0,0,1,1,0,0,1,0,0,0,0,0,0,0,0,0,0,0,0,0,0,0,1,0,0,0,0,0,0,0,0,0,0,0,0,0,0,0,0,0
51,name depart credit,0,0,1,0,0,0,0,0,0,0,0,0,0,0,0,1,0,0,0,0,1,1,0,0,1,0,0,0,0,0,0,0,0,0,0,0,0,0,0,0,1,0,0,0,0,0,0,0,0,0,0,0,0,0,0,0,0,0
52,list name cours order titl credit,0,0,1,0,0,0,0,0,0,0,0,0,0,0,0,0,0,0,0,1,0,1,0,0,0,0,0,0,0,0,0,0,0,0,0,0,0,0,0,0,0,0,0,0,0,0,0,0,0,0,0,0,0,0,0,0,0,0
53,given titl cours order titl credit,0,0,1,0,0,0,0,0,0,0,0,0,0,0,0,0,0,0,0,1,0,1,0,0,0,0,0,0,0,0,0,0,0,0,0,0,0,0,0,0,0,0,0,0,0,0,0,0,0,0,0,0,0,0,0,0,0,0
54,depart lowest budget,0,1,0,0,0,0,0,0,0,0,0,0,0,0,0,1,0,1,0,0,1,0,0,0,1,0,0,0,0,0,0,0,0,0,0,0,0,0,0,0,1,0,0,0,0,0,0,0,0,0,0,0,0,0,0,0,0,0
55,give name depart lowest budget,0,1,0,0,0,0,0,0,0,0,0,0,0,0,0,1,0,1,0,0,1,0,0,0,1,0,0,0,0,0,0,0,0,0,0,0,0,0,0,0,1,0,0,0,0,0,0,0,0,0,0,0,0,0,0,0,0,0
56,list name build depart sort budget larg small,0,1,0,0,0,0,0,0,0,0,0,0,1,0,0,1,1,1,0,0,1,0,0,0,1,0,0,0,0,0,1,0,0,0,0,0,0,0,0,0,1,0,0,0,0,0,0,0,0,0,0,0,0,0,0,0,0,0
57,name build depar sort budget descend,0,1,0,0,0,0,0,0,0,0,0,0,1,0,0,1,1,1,0,0,1,0,0,0,1,0,0,0,0,0,1,0,0,0,0,0,0,0,0,0,1,0,0,0,0,0,0,0,0,0,0,0,0,0,0,0,0,0
58,instructor highest salari,0,0,0,1,0,0,0,0,0,0,0,0,0,0,0,0,0,0,0,0,0,0,0,1,0,1,0,0,0,0,0,0,0,0,0,0,0,0,0,1,0,0,0,0,0,0,0,0,0,0,0,0,0,0,0,0,0,0
59,give name highest paid instructor,0,0,0,1,0,0,0,0,0,0,0,0,0,0,0,0,0,0,0,0,0,0,0,1,0,1,0,0,0,0,0,0,0,0,0,0,0,0,0,1,0,0,0,0,0,0,0,0,0,0,0,0,0,0,0,0,0,0
60,list inform instructor order salari ascend order,0,0,0,1,0,0,0,0,0,0,0,1,0,0,0,0,0,0,0,0,0,0,0,0,0,1,0,0,0,0,0,0,0,0,0,0,0,0,0,0,0,0,0,0,0,0,0,0,0,0,0,0,0,0,0,0,0,0
61,give inform regard instructor order salari least greatest,0,0,0,1,0,0,0,0,0,0,0,1,0,0,0,0,0,0,0,0,0,0,0,0,0,1,0,0,0,0,0,0,0,0,0,0,0,0,0,0,0,0,0,0,0,0,0,0,0,0,0,0,0,0,0,0,0,0
62,find name student depart name sort total credit ascend order,0,0,0,0,0,0,1,0,0,0,0,0,0,0,0,1,0,0,0,0,1,0,0,1,1,0,0,0,0,0,0,0,0,0,0,0,0,0,0,1,1,1,0,0,0,0,0,0,0,0,0,0,0,0,0,0,0,0
63,name student respect depart order number credit least greatest,0,0,0,0,0,0,1,0,0,0,0,0,0,0,0,1,0,0,0,0,1,0,0,1,1,0,0,0,0,0,0,0,0,0,0,0,0,0,0,1,1,1,0,0,0,0,0,0,0,0,0,0,0,0,0,0,0,0
64,list alphabet order cours name instructor name year 2008,0,0,1,1,0,1,0,0,0,0,0,0,0,0,0,0,0,0,1,1,0,0,1,1,0,0,1,0,0,1,0,0,0,1,1,0,0,1,1,1,0,0,1,1,0,0,1,0,0,0,0,0,0,0,0,0,1,0
65,show titl instructor name cours 2008 alphabet order titl,0,0,1,1,0,1,0,0,0,0,0,0,0,0,0,0,0,0,1,1,0,0,1,1,0,0,1,0,0,1,0,0,0,1,1,0,0,1,1,1,0,0,1,1,0,0,1,0,0,0,0,0,0,0,0,0,1,0
66,find name instructor advis one student,0,0,0,1,0,0,0,0,1,0,0,1,0,0,0,0,0,0,0,0,0,0,1,1,0,0,0,0,0,0,0,0,0,1,0,0,0,0,1,1,0,0,1,0,0,0,0,0,0,1,0,0,0,0,0,0,0,0
67,name instructor advis one student,0,0,0,1,0,0,0,0,1,0,0,1,0,0,0,0,0,0,0,0,0,0,1,1,0,0,0,0,0,0,0,0,0,1,0,0,0,0,1,1,0,0,1,0,0,0,0,0,0,1,0,0,0,0,0,0,0,0
68,find name student one advisor,0,0,0,0,0,0,1,0,1,0,0,1,0,0,0,0,0,0,0,0,0,0,1,1,0,0,0,0,0,0,0,0,0,1,0,0,0,0,1,1,0,0,1,0,0,0,0,0,1,0,0,0,0,0,0,0,0,0
69,name student one advisor,0,0,0,0,0,0,1,0,1,0,0,1,0,0,0,0,0,0,0,0,0,0,1,1,0,0,0,0,0,0,0,0,0,1,0,0,0,0,1,1,0,0,1,0,0,0,0,0,1,0,0,0,0,0,0,0,0,0
70,find number room 50 capac build,1,0,0,0,0,0,0,0,0,0,0,1,1,0,1,0,1,0,0,0,0,0,0,0,0,0,0,0,0,0,1,0,0,0,0,0,0,0,0,0,0,0,0,0,0,0,0,0,0,0,0,0,0,0,0,0,0,0
71,mani room build capac 50,1,0,0,0,0,0,0,0,0,0,0,1,1,0,1,0,1,0,0,0,0,0,0,0,0,0,0,0,0,0,1,0,0,0,0,0,0,0,0,0,0,0,0,0,0,0,0,0,0,0,0,0,0,0,0,0,0,0
72,find maximum averag capac among room build,1,0,0,0,0,0,0,0,0,0,0,0,1,0,1,0,1,0,0,0,0,0,0,0,0,0,0,0,0,0,1,0,0,0,0,0,0,0,0,0,0,0,0,0,0,0,0,0,0,0,0,0,0,0,0,0,0,0
73,greatest averag capac room build,1,0,0,0,0,0,0,0,0,0,0,0,1,0,1,0,1,0,0,0,0,0,0,0,0,0,0,0,0,0,1,0,0,0,0,0,0,0,0,0,0,0,0,0,0,0,0,0,0,0,0,0,0,0,0,0,0,0
74,find titl cours offer one depart,0,0,1,0,0,0,0,0,0,0,0,1,0,0,0,0,0,0,0,1,0,0,0,0,0,0,0,0,0,0,0,0,0,0,0,0,0,0,0,0,0,0,0,0,0,0,0,0,0,0,0,0,0,0,0,0,0,0
75,titl cours offer one depart,0,0,1,0,0,0,0,0,0,0,0,1,0,0,0,0,0,0,0,1,0,0,0,0,0,0,0,0,0,0,0,0,0,0,0,0,0,0,0,0,0,0,0,0,0,0,0,0,0,0,0,0,0,0,0,0,0,0
76,find total credit cours provid differ depart,0,0,1,0,0,0,0,0,0,0,0,0,0,0,0,1,0,0,0,0,1,1,0,0,1,0,0,0,0,0,0,0,0,0,0,0,0,0,0,0,1,0,0,0,0,0,0,0,0,0,0,0,0,0,0,0,0,0
77,mani total credit offer depart,0,0,1,0,0,0,0,0,0,0,0,0,0,0,0,1,0,0,0,0,1,1,0,0,1,0,0,0,0,0,0,0,0,0,0,0,0,0,0,0,1,0,0,0,0,0,0,0,0,0,0,0,0,0,0,0,0,0
78,find minimum salari depart whose averag salari averag payment instructor,0,0,0,1,0,0,0,0,0,0,0,0,0,0,0,1,0,0,0,0,1,0,0,0,1,1,0,0,0,0,0,0,0,0,0,0,0,0,0,0,1,0,0,0,0,0,0,0,0,0,0,0,0,0,0,0,0,0
79,lowest salari depart averag salari greater overal averag,0,0,0,1,0,0,0,0,0,0,0,0,0,0,0,1,0,0,0,0,1,0,0,0,1,1,0,0,0,0,0,0,0,0,0,0,0,0,0,0,1,0,0,0,0,0,0,0,0,0,0,0,0,0,0,0,0,0
80,find number cours provid semest year,0,0,0,0,1,0,0,0,0,0,0,1,0,0,0,0,0,0,0,0,0,0,0,0,0,0,0,0,1,1,0,0,0,0,0,0,1,1,0,0,0,0,0,0,0,1,1,0,0,0,0,0,0,0,0,0,0,0
81,mani cours provid semest year,0,0,0,0,1,0,0,0,0,0,0,1,0,0,0,0,0,0,0,0,0,0,0,0,0,0,0,0,1,1,0,0,0,0,0,0,1,1,0,0,0,0,0,0,0,1,1,0,0,0,0,0,0,0,0,0,0,0
82,find year offer largest number cours,0,0,0,0,1,0,0,0,0,0,0,1,0,0,0,0,0,0,0,0,0,0,0,0,0,0,0,0,0,1,0,0,0,0,0,0,0,1,0,0,0,0,0,0,0,0,1,0,0,0,0,0,0,0,0,0,0,0
83,year greatest number cours,0,0,0,0,1,0,0,0,0,0,0,1,0,0,0,0,0,0,0,0,0,0,0,0,0,0,0,0,0,1,0,0,0,0,0,0,0,1,0,0,0,0,0,0,0,0,1,0,0,0,0,0,0,0,0,0,0,0
84,find year semest offer largest number cours,0,0,0,0,1,0,0,0,0,0,0,1,0,0,0,0,0,0,0,0,0,0,0,0,0,0,0,0,1,1,0,0,0,0,0,0,1,1,0,0,0,0,0,0,0,1,1,0,0,0,0,0,0,0,0,0,0,0
85,year semest cours,0,0,0,0,1,0,0,0,0,0,0,1,0,0,0,0,0,0,0,0,0,0,0,0,0,0,0,0,1,1,0,0,0,0,0,0,1,1,0,0,0,0,0,0,0,1,1,0,0,0,0,0,0,0,0,0,0,0
86,find name depart highest amount student,0,0,0,0,0,0,1,0,0,0,0,1,0,0,0,1,0,0,0,0,1,0,0,0,1,0,0,0,0,0,0,0,0,0,0,0,0,0,0,0,1,0,0,0,0,0,0,0,0,0,0,0,0,0,0,0,0,0
87,name depar highest enrol,0,0,0,0,0,0,1,0,0,0,0,1,0,0,0,1,0,0,0,0,1,0,0,0,1,0,0,0,0,0,0,0,0,0,0,0,0,0,0,0,1,0,0,0,0,0,0,0,0,0,0,0,0,0,0,0,0,0
88,find total number student depart,0,0,0,0,0,0,1,0,0,0,0,1,0,0,0,1,0,0,0,0,1,0,0,0,1,0,0,0,0,0,0,0,0,0,0,0,0,0,0,0,1,0,0,0,0,0,0,0,0,0,0,0,0,0,0,0,0,0
89,mani student depart,0,0,0,0,0,0,1,0,0,0,0,1,0,0,0,1,0,0,0,0,1,0,0,0,1,0,0,0,0,0,0,0,0,0,0,0,0,0,0,0,1,0,0,0,0,0,0,0,0,0,0,0,0,0,0,0,0,0
90,find semest year least number student take class,0,0,0,0,0,0,0,1,0,0,0,1,0,0,0,0,0,0,0,0,0,0,0,0,0,0,0,0,1,1,0,0,0,0,0,0,1,1,0,0,0,0,0,0,0,1,1,0,0,0,0,0,0,0,0,0,0,0
91,semeset year fewest student,0,0,0,0,0,0,0,1,0,0,0,1,0,0,0,0,0,0,0,0,0,0,0,0,0,0,0,0,1,1,0,0,0,0,0,0,1,1,0,0,0,0,0,0,0,1,1,0,0,0,0,0,0,0,0,0,0,0
92,id instructor advis student histori depart,0,0,0,0,0,0,1,0,1,0,0,0,0,0,0,1,0,0,0,0,1,0,1,0,1,0,0,0,0,0,0,0,0,1,0,0,0,0,1,0,1,0,1,0,0,0,0,0,1,1,0,0,0,0,0,0,0,0
93,give id instructor advis student histori depart,0,0,0,0,0,0,1,0,1,0,0,0,0,0,0,1,0,0,0,0,1,0,1,0,1,0,0,0,0,0,0,0,0,1,0,0,0,0,1,0,1,0,1,0,0,0,0,0,1,1,0,0,0,0,0,0,0,0
94,find name salari instructor advisor student histori depart,0,0,0,1,0,0,1,0,1,0,0,0,0,0,0,1,0,0,0,0,1,0,1,1,1,1,0,0,0,0,0,0,0,1,0,0,0,0,1,1,1,0,1,0,0,0,0,0,1,1,0,0,0,0,0,0,0,0
95,name salari instructor advis student histori depart,0,0,0,1,0,0,1,0,1,0,0,0,0,0,0,1,0,0,0,0,1,0,1,1,1,1,0,0,0,0,0,0,0,1,0,0,0,0,1,1,1,0,1,0,0,0,0,0,1,1,0,0,0,0,0,0,0,0
96,find id cours prerequisit,0,0,1,0,0,0,0,0,0,0,1,0,0,0,0,0,0,0,1,0,0,0,0,0,0,0,1,0,0,0,0,0,0,0,1,0,0,0,0,0,0,0,0,1,0,0,0,0,0,0,0,0,0,0,0,0,1,0
97,id cours without prerequisit,0,0,1,0,0,0,0,0,0,0,1,0,0,0,0,0,0,0,1,0,0,0,0,0,0,0,1,0,0,0,0,0,0,0,1,0,0,0,0,0,0,0,0,1,0,0,0,0,0,0,0,0,0,0,0,0,1,0
98,find name cours prerequisit,0,0,1,0,0,0,0,0,0,0,1,0,0,0,0,0,0,0,1,1,0,0,0,0,0,0,1,0,0,0,0,0,0,0,1,0,0,0,0,0,0,0,0,1,0,0,0,0,0,0,0,0,0,0,0,0,1,0
99,name cours without prerequisit,0,0,1,0,0,0,0,0,0,0,1,0,0,0,0,0,0,0,1,1,0,0,0,0,0,0,1,0,0,0,0,0,0,0,1,0,0,0,0,0,0,0,0,1,0,0,0,0,0,0,0,0,0,0,0,0,1,0
100,titl prerequisit class intern financ cours,0,0,1,0,0,0,0,0,0,0,1,0,0,0,0,0,0,0,1,1,0,0,0,0,0,0,1,0,0,0,0,0,0,0,1,0,0,0,0,0,0,0,0,1,0,0,0,0,0,0,0,0,0,0,0,0,1,1
101,give titl prerequisit cours intern financ,0,0,1,0,0,0,0,0,0,0,1,0,0,0,0,0,0,0,1,1,0,0,0,0,0,0,1,0,0,0,0,0,0,0,1,0,0,0,0,0,0,0,0,1,0,0,0,0,0,0,0,0,0,0,0,0,1,1
102,find titl cours whose prerequisit cours differenti geometri,0,0,1,0,0,0,0,0,0,0,1,0,0,0,0,0,0,0,1,1,0,0,0,0,0,0,1,0,0,0,0,0,0,0,1,0,0,0,0,0,0,0,0,1,0,0,0,0,0,0,0,0,0,0,0,0,1,1
103,titl cours differenti geometri prerequisit,0,0,1,0,0,0,0,0,0,0,1,0,0,0,0,0,0,0,1,1,0,0,0,0,0,0,1,0,0,0,0,0,0,0,1,0,0,0,0,0,0,0,0,1,0,0,0,0,0,0,0,0,0,0,0,0,1,1
104,find name student taken cours fall semest year 2003,0,0,0,0,0,0,1,1,0,0,0,0,0,0,0,0,0,0,0,0,0,0,1,1,0,0,0,0,1,1,0,0,0,1,0,0,1,1,1,1,0,0,1,0,0,1,1,0,0,0,0,0,0,0,0,0,0,0
105,name student took cours fall 2003,0,0,0,0,0,0,1,1,0,0,0,0,0,0,0,0,0,0,0,0,0,0,1,1,0,0,0,0,1,1,0,0,0,1,0,0,1,1,1,1,0,0,1,0,0,1,1,0,0,0,0,0,0,0,0,0,0,0
106,titl cours offer build chandler fall semest year 2010,0,0,1,0,1,0,0,0,0,0,0,0,1,0,0,0,1,0,1,1,0,0,0,0,0,0,1,0,1,1,1,0,0,0,1,0,1,1,0,0,0,0,0,1,0,1,1,0,0,0,0,0,0,0,0,0,1,0
107,give titl cours offer chandler fall 2010,0,0,1,0,1,0,0,0,0,0,0,0,1,0,0,0,1,0,1,1,0,0,0,0,0,0,1,0,1,1,1,0,0,0,1,0,1,1,0,0,0,0,0,1,0,1,1,0,0,0,0,0,0,0,0,0,1,0
108,find name instructor taught c program cours,0,0,1,1,0,1,0,0,0,0,0,0,0,0,0,0,0,0,1,1,0,0,1,1,0,0,1,0,0,0,0,0,0,1,1,0,0,0,1,1,0,0,1,1,0,0,0,0,0,0,0,0,0,0,0,0,1,0
109,name instructor taught c program cours,0,0,1,1,0,1,0,0,0,0,0,0,0,0,0,0,0,0,1,1,0,0,1,1,0,0,1,0,0,0,0,0,0,1,1,0,0,0,1,1,0,0,1,1,0,0,0,0,0,0,0,0,0,0,0,0,1,0
110,find name salari instructor advisor student math depart,0,0,0,1,0,0,1,0,1,0,0,0,0,0,0,1,0,0,0,0,1,0,1,1,1,1,0,0,0,0,0,0,0,1,0,0,0,0,1,1,1,0,1,0,0,0,0,0,1,1,0,0,0,0,0,0,0,0
111,name salari instructor advis student math depart,0,0,0,1,0,0,1,0,1,0,0,0,0,0,0,1,0,0,0,0,1,0,1,1,1,1,0,0,0,0,0,0,0,1,0,0,0,0,1,1,1,0,1,0,0,0,0,0,1,1,0,0,0,0,0,0,0,0
112,find name instructor advisor student math depart sort result student total credit,0,0,0,1,0,0,1,0,1,0,0,0,0,0,0,1,0,0,0,0,1,0,1,1,1,0,0,0,0,0,0,0,0,1,0,0,0,0,1,1,1,1,1,0,0,0,0,0,1,1,0,0,0,0,0,0,0,0
113,name instructor advis student math depart sort total credit student,0,0,0,1,0,0,1,0,1,0,0,0,0,0,0,1,0,0,0,0,1,0,1,1,1,0,0,0,0,0,0,0,0,1,0,0,0,0,1,1,1,1,1,0,0,0,0,0,1,1,0,0,0,0,0,0,0,0
114,cours titl prerequisit cours mobil comput,0,0,1,0,0,0,0,0,0,0,1,0,0,0,0,0,0,0,1,1,0,0,0,0,0,0,1,0,0,0,0,0,0,0,1,0,0,0,0,0,0,0,0,1,0,0,0,0,0,0,0,0,0,0,0,0,1,1
115,titl cours prerequisit mobil comput,0,0,1,0,0,0,0,0,0,0,1,0,0,0,0,0,0,0,1,1,0,0,0,0,0,0,1,0,0,0,0,0,0,0,1,0,0,0,0,0,0,0,0,1,0,0,0,0,0,0,0,0,0,0,0,0,1,1
116,find name instructor advisor student highest number total credit,0,0,0,1,0,0,1,0,1,0,0,0,0,0,0,0,0,0,0,0,0,0,1,1,0,0,0,0,0,0,0,0,0,1,0,0,0,0,1,1,0,1,1,0,0,0,0,0,1,1,0,0,0,0,0,0,0,0
117,name instructor advis student greatest number total credit,0,0,0,1,0,0,1,0,1,0,0,0,0,0,0,0,0,0,0,0,0,0,1,1,0,0,0,0,0,0,0,0,0,1,0,0,0,0,1,1,0,1,1,0,0,0,0,0,1,1,0,0,0,0,0,0,0,0
118,find name instructor teach cours,0,0,0,1,0,1,0,0,0,0,0,0,0,0,0,0,0,0,0,0,0,0,1,1,0,0,0,0,0,0,0,0,0,1,0,0,0,0,1,1,0,0,1,0,0,0,0,0,0,0,0,0,0,0,0,0,0,0
119,name instructor teach,0,0,0,1,0,1,0,0,0,0,0,0,0,0,0,0,0,0,0,0,0,0,1,1,0,0,0,0,0,0,0,0,0,1,0,0,0,0,1,1,0,0,1,0,0,0,0,0,0,0,0,0,0,0,0,0,0,0
120,find id instructor teach cours,0,0,0,1,0,1,0,0,0,0,0,0,0,0,0,0,0,0,0,0,0,0,1,0,0,0,0,0,0,0,0,0,0,1,0,0,0,0,1,0,0,0,1,0,0,0,0,0,0,0,0,0,0,0,0,0,0,0
121,id instructor didnt teach,0,0,0,1,0,1,0,0,0,0,0,0,0,0,0,0,0,0,0,0,0,0,1,0,0,0,0,0,0,0,0,0,0,1,0,0,0,0,1,0,0,0,1,0,0,0,0,0,0,0,0,0,0,0,0,0,0,0
122,find name instructor cours spring semest,0,0,0,1,0,1,0,0,0,0,0,0,0,0,0,0,0,0,0,0,0,0,1,1,0,0,0,0,1,0,0,0,0,1,0,0,1,0,1,1,0,0,1,0,0,1,0,0,0,0,0,0,0,0,0,0,0,0
123,name instructor teach cours spring,0,0,0,1,0,1,0,0,0,0,0,0,0,0,0,0,0,0,0,0,0,0,1,1,0,0,0,0,1,0,0,0,0,1,0,0,1,0,1,1,0,0,1,0,0,1,0,0,0,0,0,0,0,0,0,0,0,0
124,find name depart highest averag salari professor,0,0,0,1,0,0,0,0,0,0,0,0,0,0,0,1,0,0,0,0,1,0,0,0,1,1,0,0,0,0,0,0,0,0,0,0,0,0,0,0,1,0,0,0,0,0,0,0,0,0,0,0,0,0,0,0,0,0
125,depart highest averag instructor salari,0,0,0,1,0,0,0,0,0,0,0,0,0,0,0,1,0,0,0,0,1,0,0,0,1,1,0,0,0,0,0,0,0,0,0,0,0,0,0,0,1,0,0,0,0,0,0,0,0,0,0,0,0,0,0,0,0,0
126,find number averag salari instructor depart highest budget,0,1,0,1,0,0,0,0,0,0,0,1,0,0,0,1,0,1,0,0,1,0,0,0,1,1,0,0,0,0,0,0,0,0,0,0,0,0,0,0,1,0,0,0,0,0,0,0,0,0,0,0,0,0,0,0,0,0
127,mani instructor depart highest budget averag salari,0,1,0,1,0,0,0,0,0,0,0,1,0,0,0,1,0,1,0,0,1,0,0,0,1,1,0,0,0,0,0,0,0,0,0,0,0,0,0,0,1,0,0,0,0,0,0,0,0,0,0,0,0,0,0,0,0,0
128,titl credit cours taught largest classroom highest capac,1,0,1,0,1,0,0,0,0,0,0,0,1,1,1,0,1,0,1,1,0,1,0,0,0,0,1,0,0,0,1,1,0,0,1,0,0,0,0,0,0,0,0,1,0,0,0,0,0,0,0,0,0,0,0,0,1,0
129,give titl credit cours taught classroom greatest capac,1,0,1,0,1,0,0,0,0,0,0,0,1,1,1,0,1,0,1,1,0,1,0,0,0,0,1,0,0,0,1,1,0,0,1,0,0,0,0,0,0,0,0,1,0,0,0,0,0,0,0,0,0,0,0,0,1,0
130,find name student take cours biolog depart,0,0,1,0,0,0,1,1,0,0,0,0,0,0,0,1,0,0,1,0,1,0,1,1,1,0,1,0,0,0,0,0,0,1,1,0,0,0,1,1,1,0,1,1,0,0,0,0,0,0,0,0,0,0,0,0,1,0
131,name student taken biolog cours,0,0,1,0,0,0,1,1,0,0,0,0,0,0,0,1,0,0,1,0,1,0,1,1,1,0,1,0,0,0,0,0,0,1,1,0,0,0,1,1,1,0,1,1,0,0,0,0,0,0,0,0,0,0,0,0,1,0
132,find total number student total number instructor depart,0,1,0,1,0,0,1,0,0,0,0,0,0,0,0,1,0,0,0,0,1,0,1,0,1,0,0,0,0,0,0,0,0,1,0,0,0,0,1,0,1,0,1,0,0,0,0,0,0,0,0,0,0,0,0,0,0,0
133,mani student instructor depart,0,1,0,1,0,0,1,0,0,0,0,0,0,0,0,1,0,0,0,0,1,0,1,0,1,0,0,0,0,0,0,0,0,1,0,0,0,0,1,0,1,0,1,0,0,0,0,0,0,0,0,0,0,0,0,0,0,0
134,find name student taken prerequisit cours cours titl intern financ,0,0,1,0,0,0,1,1,0,0,1,0,0,0,0,0,0,0,1,1,0,0,1,1,0,0,1,0,0,0,0,0,0,1,1,0,0,0,1,1,0,0,1,1,0,0,0,0,0,0,0,0,0,0,0,0,1,1
135,name student taken prerequisit cours intern financ,0,0,1,0,0,0,1,1,0,0,1,0,0,0,0,0,0,0,1,1,0,0,1,1,0,0,1,0,0,0,0,0,0,1,1,0,0,0,1,1,0,0,1,1,0,0,0,0,0,0,0,0,0,0,0,0,1,1
136,find name salari instructor whose salari averag salari instructor physic depart,0,0,0,1,0,0,0,0,0,0,0,0,0,0,0,1,0,0,0,0,1,0,0,1,1,1,0,0,0,0,0,0,0,0,0,0,0,0,0,1,1,0,0,0,0,0,0,0,0,0,0,0,0,0,0,0,0,0
137,name salari instructor earn less averag salari instructor physic depart,0,0,0,1,0,0,0,0,0,0,0,0,0,0,0,1,0,0,0,0,1,0,0,1,1,1,0,0,0,0,0,0,0,0,0,0,0,0,0,1,1,0,0,0,0,0,0,0,0,0,0,0,0,0,0,0,0,0
138,find name student took cours offer statist depart,0,0,1,0,0,0,1,1,0,0,0,0,0,0,0,1,0,0,1,0,1,0,1,1,1,0,1,0,0,0,0,0,0,1,1,0,0,0,1,1,1,0,1,1,0,0,0,0,0,0,0,0,0,0,0,0,1,0
139,name student taken statist cours,0,0,1,0,0,0,1,1,0,0,0,0,0,0,0,1,0,0,1,0,1,0,1,1,1,0,1,0,0,0,0,0,0,1,1,0,0,0,1,1,1,0,1,1,0,0,0,0,0,0,0,0,0,0,0,0,1,0
140,find build room number semest year cours offer psycholog depart sort cours titl,0,0,1,0,1,0,0,0,0,0,0,0,1,1,0,1,1,0,1,1,1,0,0,0,1,0,1,0,1,1,1,1,0,0,1,0,1,1,0,0,1,0,0,1,0,1,1,0,0,0,0,0,0,0,0,0,1,0
141,build room number semest year cours psycholog depart sort use cours titl,0,0,1,0,1,0,0,0,0,0,0,0,1,1,0,1,1,0,1,1,1,0,0,0,1,0,1,0,1,1,1,1,0,0,1,0,1,1,0,0,1,0,0,1,0,1,1,0,0,0,0,0,0,0,0,0,1,0
142,find name instructor comput scienc depart,0,0,0,1,0,0,0,0,0,0,0,0,0,0,0,1,0,0,0,0,1,0,0,1,1,0,0,0,0,0,0,0,0,0,0,0,0,0,0,1,1,0,0,0,0,0,0,0,0,0,0,0,0,0,0,0,0,0
143,name instructor comp sci depart,0,0,0,1,0,0,0,0,0,0,0,0,0,0,0,1,0,0,0,0,1,0,0,1,1,0,0,0,0,0,0,0,0,0,0,0,0,0,0,1,1,0,0,0,0,0,0,0,0,0,0,0,0,0,0,0,0,0
144,find name instructor comp sci depart salari 80000,0,0,0,1,0,0,0,0,0,0,0,0,0,0,0,1,0,0,0,0,1,0,0,1,1,1,0,0,0,0,0,0,0,0,0,0,0,0,0,1,1,0,0,0,0,0,0,0,0,0,0,0,0,0,0,0,0,0
145,name instructor comp sci depart earn 80000,0,0,0,1,0,0,0,0,0,0,0,0,0,0,0,1,0,0,0,0,1,0,0,1,1,1,0,0,0,0,0,0,0,0,0,0,0,0,0,1,1,0,0,0,0,0,0,0,0,0,0,0,0,0,0,0,0,0
146,find name instructor taught cours cours id,0,0,0,1,0,1,0,0,0,0,0,0,0,0,0,0,0,0,1,0,0,0,1,1,0,0,1,0,0,0,0,0,0,1,1,0,0,0,1,1,0,0,1,1,0,0,0,0,0,0,0,0,0,0,0,0,1,0
147,name instructor taught cours well correspond cours id,0,0,0,1,0,1,0,0,0,0,0,0,0,0,0,0,0,0,1,0,0,0,1,1,0,0,1,0,0,0,0,0,0,1,1,0,0,0,1,1,0,0,1,1,0,0,0,0,0,0,0,0,0,0,0,0,1,0
148,find name instructor art depart taught cours cours id,0,0,0,1,0,1,0,0,0,0,0,0,0,0,0,1,0,0,1,0,1,0,1,1,1,0,1,0,0,0,0,0,0,1,1,0,0,0,1,1,1,0,1,1,0,0,0,0,0,0,0,0,0,0,0,0,1,0
149,name art instructor taught cours correspond cours id,0,0,0,1,0,1,0,0,0,0,0,0,0,0,0,1,0,0,1,0,1,0,1,1,1,0,1,0,0,0,0,0,0,1,1,0,0,0,1,1,1,0,1,1,0,0,0,0,0,0,0,0,0,0,0,0,1,0
150,find name instructor whose name includ substr dar,0,0,0,1,0,0,0,0,0,0,0,0,0,0,0,0,0,0,0,0,0,0,0,1,0,0,0,0,0,0,0,0,0,0,0,0,0,0,0,1,0,0,0,0,0,0,0,0,0,0,0,0,0,0,0,0,0,0
151,name instructor name includ dar,0,0,0,1,0,0,0,0,0,0,0,0,0,0,0,0,0,0,0,0,0,0,0,1,0,0,0,0,0,0,0,0,0,0,0,0,0,0,0,1,0,0,0,0,0,0,0,0,0,0,0,0,0,0,0,0,0,0
152,list alphabet order name distinct instructor,0,0,0,1,0,0,0,0,0,0,0,0,0,0,0,0,0,0,0,0,0,0,0,1,0,0,0,0,0,0,0,0,0,0,0,0,0,0,0,1,0,0,0,0,0,0,0,0,0,0,0,0,0,0,0,0,0,0
153,list distinct name instructor order name,0,0,0,1,0,0,0,0,0,0,0,0,0,0,0,0,0,0,0,0,0,0,0,1,0,0,0,0,0,0,0,0,0,0,0,0,0,0,0,1,0,0,0,0,0,0,0,0,0,0,0,0,0,0,0,0,0,0
154,find cours ran fall 2009 spring 2010,0,0,0,0,1,0,0,0,0,0,0,0,0,0,0,0,0,0,1,0,0,0,0,0,0,0,1,0,1,1,0,0,0,0,1,0,1,1,0,0,0,0,0,1,0,1,1,0,0,0,0,0,0,0,0,0,1,0
155,id cours fall 2009 spring 2010,0,0,0,0,1,0,0,0,0,0,0,0,0,0,0,0,0,0,1,0,0,0,0,0,0,0,1,0,1,1,0,0,0,0,1,0,1,1,0,0,0,0,0,1,0,1,1,0,0,0,0,0,0,0,0,0,1,0
156,find cours ran fall 2009 spring 2010,0,0,0,0,1,0,0,0,0,0,0,0,0,0,0,0,0,0,1,0,0,0,0,0,0,0,1,0,1,1,0,0,0,0,1,0,1,1,0,0,0,0,0,1,0,1,1,0,0,0,0,0,0,0,0,0,1,0
157,id cours offer fall 2009 spring 2010,0,0,0,0,1,0,0,0,0,0,0,0,0,0,0,0,0,0,1,0,0,0,0,0,0,0,1,0,1,1,0,0,0,0,1,0,1,1,0,0,0,0,0,1,0,1,1,0,0,0,0,0,0,0,0,0,1,0
158,find cours ran fall 2009 spring 2010,0,0,0,0,1,0,0,0,0,0,0,0,0,0,0,0,0,0,1,0,0,0,0,0,0,0,1,0,1,1,0,0,0,0,1,0,1,1,0,0,0,0,0,1,0,1,1,0,0,0,0,0,0,0,0,0,1,0
159,id cours offer fall 2009 spring 2010,0,0,0,0,1,0,0,0,0,0,0,0,0,0,0,0,0,0,1,0,0,0,0,0,0,0,1,0,1,1,0,0,0,0,1,0,1,1,0,0,0,0,0,1,0,1,1,0,0,0,0,0,0,0,0,0,1,0
